Date,Repository-Link,Github-Link,Summary,Readme-Text,Classification,Image-Links,Video-Links,Stars,Suitable-Image-Links,Suitable-Video-Links,Repository-Creation-Date
2024-02-27,https://github.com/Pythagora-io/gpt-pilot,https://raw.githubusercontent.com/Pythagora-io/gpt-pilot/main/README.md,"GPT Pilot is an innovative AI developer tool that assists in the entire development process of building apps. After a user specifies the type of application they want to create, GPT Pilot engages in a conversational manner, asking for clarifications and creating product and technical requirements. It takes charge of setting up the development environment and codes the application step by step, involving the user for code reviews and problem-solving as needed. Essentially, with GPT Pilot, the user acts as a lead developer, guiding the AI in its coding tasks. This tool is designed to be a comprehensive AI developer companion beyond merely providing code autocompletion or assistance with pull request messages. It aims to handle writing full features, debugging, and engaging with the developer on code review and issues, making it a groundbreaking step towards utilizing AI in real-world application development. The process is meant to cover most coding aspects (around 95%), with the anticipation that a human developer's insight will be necessary for the remainder, underscoring the current limitations and future potential of AI in software development.",,AI-Assistant-System,,https://www.youtube.com/watch?v=-OB6BJKADEo; https://www.youtube.com/watch?v=7t-Q2e7QsbE; https://www.youtube.com/watch?v=bUj9DbMRYhA; https://www.youtube.com/watch?v=uZeA1iX9dgg; https://www.youtube.com/watch?v=CMN3W18zfiE,21902,,,2023-08-16T11:56:07Z
2024-02-27,https://github.com/czbag/scroll,https://raw.githubusercontent.com/czbag/scroll/main/README.md,"Scroll Soft is software designed to simplify wallet management on the Scroll network, offering a plethora of features and increased security through high randomization. It supports functions such as deposits and withdrawals via various bridges (official, Orbiter, LayerSwap, Nitro), wrapping and unwrapping ETH, multiple swapping options (SkyDrome, SyncSwap, Zebra, XySwap with a referral code), and lending protocols (LayerBank, Aave). Users can mint and bridge NFTs across chains, vote with RubyScore, create Gnosis Safe, deploy contracts, and more, with custom sequential or random actions. Installation involves cloning the repository, installing dependencies, and configuring necessary modules. Basic and module-specific settings are adjusted in settings.py and modules_settings.py, with private keys stored in accounts.txt and RPC configurations in rpc.json. Further updates and information are shared via a Telegram blog link provided.",,Wallet-Management,,,147,,,2023-10-18T13:07:25Z
2024-02-27,https://github.com/jackfrued/Python-100-Days,https://raw.githubusercontent.com/joaomdmoura/crewAI/main/README.md,"crewAI is a state-of-the-art framework designed to orchestrate role-playing, autonomous AI agents, allowing them to collaborate effectively on complex tasks. It enables AI agents to assume specific roles, share goals, and operate cohesively, making it ideal for creating smart assistant platforms, automated customer services, and multi-agent research teams. The framework supports role-based agent design, autonomous inter-agent delegation, flexible task management, and works with open-source models. Installation is straightforward via pip, and it offers a variety of examples, such as trip planners and stock analysis. CrewAI also allows for dynamic and adaptable processes, improving over the limitations of other frameworks like Autogen and ChatDev by combining their strengths without inheriting their rigidity. It is open-source, inviting contributions from the developer community. CrewAI also collects anonymous telemetry to improve user experience but ensures sensitive data like API calls and agent backstories remain private. It is licensed under the MIT License, encouraging wide adoption and modification.",,AI-Assistant-System,https://raw.githubusercontent.com/joaomdmoura/crewAI/main/./docs/crewai_logo.png; https://img.youtube.com/vi/tnejrr-0a94/maxresdefault.jpg; https://img.youtube.com/vi/xis7rWp-hjs/maxresdefault.jpg; https://img.youtube.com/vi/e0Uj4yWdaAg/maxresdefault.jpg,https://www.youtube.com/watch?v=tnejrr-0a94; https://www.youtube.com/watch?v=xis7rWp-hjs; https://www.youtube.com/watch?v=e0Uj4yWdaAg,8237,https://raw.githubusercontent.com/joaomdmoura/crewAI/main/./docs/crewai_logo.png; https://img.youtube.com/vi/tnejrr-0a94/maxresdefault.jpg; https://img.youtube.com/vi/xis7rWp-hjs/maxresdefault.jpg; https://img.youtube.com/vi/e0Uj4yWdaAg/maxresdefault.jpg,,2018-03-01T16:05:52Z
2024-02-27,https://github.com/joaomdmoura/crewAI,https://raw.githubusercontent.com/joaomdmoura/crewAI-examples/main/README.md,"crewAI is a framework developed to enhance the collaboration between role-playing AI agents. Authored by [@joaomdmoura](https://x.com/joaomdmoura), it offers a variety of examples on how to utilize this framework for automating different tasks. Examples include creating job postings, planning trips, making Instagram posts, validating Markdown, generating games, and using the Azure OpenAI API for various projects. For beginners, there's a Starter Template available to kickstart their own projects. More advanced examples cover stock analysis, generating landing pages, and integrating CrewAI with LangGraph. These examples are aimed at demonstrating the versatility and potential of crewAI in facilitating complex automated workflows.",,AI-Assistant-System,,,824,,,2023-10-27T03:26:59Z
2024-02-27,https://github.com/joaomdmoura/crewAI-examples,https://raw.githubusercontent.com/paul-gauthier/aider/main/README.md,"Aider is an AI-driven command line tool designed for pair programming alongside GPT-3.5 or GPT-4, specifically tailoring to the needs of modifying code in local git repositories. It enables direct editing of code files and commits changes with descriptive messages, making it suited for both new projects and existing repositories. A unique feature of Aider is its ability to handle changes within large pre-existing codebases. The tool also supports GPT-4 Turbo with a 128k context window for improved speed and coding accuracy, along with a unified diff editing format to enhance code quality. Users can interact with Aider using simple command-line inputs, benefitting from several in-chat commands for a more intuitive coding session. Additionally, Aider facilitates multitasking with coding by allowing voice inputs. It's highlighted for significantly boosting coding productivity and being praised as a top-tier AI coding assistant by various users. Installation and detailed use cases are accessible through Aider's documentation and support channels.",,AI-Assistant-System,,https://www.youtube.com/watch?v=df8afeb1FY8; https://www.youtube.com/watch?v=MPYFPvxfGZs,6505,,,2023-12-19T11:46:48Z
2024-02-27,https://github.com/paul-gauthier/aider,https://raw.githubusercontent.com/Lightning-AI/lit-gpt/main/README.md,"Lit-GPT is an open-source project released under the Apache 2.0 license, focusing on hackable implementations of state-of-the-art large language models (LLMs). It supports a diverse array of model checkpoints from various organizations and extends foundational works like Lit-LLaMA and nanoGPT. This implementation is designed to be simple, correct, optimized for performance, and fully open-source, emphasizing readability and hackability over avoiding code duplication. Additionally, Lit-GPT served as the official starter kit for the NeurIPS 2023 LLM Efficiency Challenge, focusing on fine-tuning LLMs efficiently on limited hardware. The project encourages community involvement, offering detailed guides for using, fine-tuning, pretraining, and even contributing to further development. It includes support for a variety of datasets and offers optimization through quantization and other techniques, aiming to democratize AI development by providing tools that are accessible and efficient on consumer-grade hardware.",,AI-Assistant-System,,,5116,,,2023-05-09T18:57:49Z
2024-02-27,https://github.com/Lightning-AI/lit-gpt,https://raw.githubusercontent.com/vinta/awesome-python/master/README.md,"This comprehensive list curated by @VintaChen on GitHub (also available on Twitter as @VintaChen) is an extensive collection of awesome Python frameworks, libraries, resources, and tools for developers. The categories covered range from web development frameworks like Django and Flask to data visualization, machine learning, and testing. It aims to be a go-to resource for Python developers seeking to find tools for specific tasks, with each section meticulously organized into subcategories for easier navigation. The list also emphasizes community contributions and encourages developers to suggest additions or improvements. For those looking to keep up with the latest in Python development, links to newsletters and podcasts are provided, offering avenues for continuous learning and engagement with the Python community.",,Python编程教程,,,199167,,,2023-05-04T17:46:11Z
2024-02-27,https://github.com/vinta/awesome-python,https://raw.githubusercontent.com/Frimkron/mud-pi/master/README.md,"MUD Pi is a basic text-based Multi-User Dungeon (MUD) game designed to run on low-end servers like the Raspberry Pi. It requires Python (2.7+ or 3.3+) and internet connectivity for remote player access. Users need a telnet client to connect, with installation guides provided for different operating systems. Instructions for running the server include using the `simplemud.py` script on Windows, Mac OSX, Linux, and via SSH with tools like `screen` to keep the script running in the background. Setting up the server requires forwarding port 1234 and knowing the server's external IP address. MUD Pi encourages expanding the game by adding features or using it as a foundation for new projects. The game, being open-source, invites tweaking and learning from its Python-based codebase. Various MUD-Pi-based projects showcase its adaptability. MUD Pi's creator, Mark Frimston, provides his contact information for feedback and further discussion.",,MUD-Game,,,322,,,2014-06-27T21:00:06Z
2024-02-27,https://github.com/Frimkron/mud-pi,https://raw.githubusercontent.com/donnemartin/system-design-primer/master/README.md,"This text presents a comprehensive guide designed to enhance the reader's understanding of system design, offering resources for learning how to design scalable systems, prepare for system design interviews, and gain insights from the open-source community. It emphasizes the importance of mastering scalable system design for career advancement and provides a structured compilation of resources covering various system design principles. The guide actively encourages contributions from the community to keep the material current and relevant. Moreover, it includes dedicated sections for preparing for system design interviews, featuring common interview questions with solutions and additional learning topics. Notably, the text introduces the use of Anki flashcards as a tool for reinforcing key concepts through spaced repetition, suggesting decks for both system design and coding interviews. Further, the guide delves into specific system design topics, elucidating on performance vs. scalability, latency vs. throughput, and availability vs. consistency, including detailed discussions on consistency and availability patterns, databases, caches, and asynchronism. The document also addresses communication protocols, security considerations, and offers an appendix for quick reference on powers of two and latency numbers crucial for system design planning. Lastly, it provides links to real-world architectures, engineering blogs, and additional system design questions, serving as a valuable resource for anyone looking to deepen their understanding of system design or prepare for technical interviews.",,System Design Primer,https://raw.githubusercontent.com/donnemartin/system-design-primer/master/images/OfVllex.png; https://raw.githubusercontent.com/donnemartin/system-design-primer/master/images/4edXG0T.png; https://raw.githubusercontent.com/donnemartin/system-design-primer/master/images/jrUBAF7.png; https://raw.githubusercontent.com/donnemartin/system-design-primer/master/images/bWxPtQA.png; https://raw.githubusercontent.com/donnemartin/system-design-primer/master/images/V5q57vU.png; https://raw.githubusercontent.com/donnemartin/system-design-primer/master/images/cdCv5g7.png; https://raw.githubusercontent.com/donnemartin/system-design-primer/master/images/4j99mhe.png; https://raw.githubusercontent.com/donnemartin/system-design-primer/master/images/MzExP06.png; https://raw.githubusercontent.com/donnemartin/system-design-primer/master/images/jj3A5N8.png,https://www.youtube.com/watch?v=ZgdS0EUmn70; https://www.youtube.com/watch?v=-W9F__D3oY4; https://www.youtube.com/watch?v=k-Yaq8AHlFA; https://www.youtube.com/watch?v=kKjm4ehYiMs; https://www.youtube.com/watch?v=kKjm4ehYiMs; https://www.youtube.com/watch?v=kKjm4ehYiMs; https://www.youtube.com/watch?v=qI_g07C_Q5I; https://www.youtube.com/watch?v=kKjm4ehYiMs; https://www.youtube.com/watch?v=1KRYH75wgy4; https://www.youtube.com/watch?v=PE4gwstWhmc; https://www.youtube.com/watch?v=b1e4t2k2KJY; https://www.youtube.com/watch?v=PE4gwstWhmc; https://www.youtube.com/watch?v=5cKTP36HVgI; https://www.youtube.com/watch?v=z8LU0Cj6BOU; https://www.youtube.com/watch?v=w5WVu624fY8,247564,https://raw.githubusercontent.com/donnemartin/system-design-primer/master/images/OfVllex.png; https://raw.githubusercontent.com/donnemartin/system-design-primer/master/images/4edXG0T.png; https://raw.githubusercontent.com/donnemartin/system-design-primer/master/images/jrUBAF7.png; https://raw.githubusercontent.com/donnemartin/system-design-primer/master/images/bWxPtQA.png; https://raw.githubusercontent.com/donnemartin/system-design-primer/master/images/V5q57vU.png; https://raw.githubusercontent.com/donnemartin/system-design-primer/master/images/cdCv5g7.png; https://raw.githubusercontent.com/donnemartin/system-design-primer/master/images/4j99mhe.png; https://raw.githubusercontent.com/donnemartin/system-design-primer/master/images/MzExP06.png; https://raw.githubusercontent.com/donnemartin/system-design-primer/master/images/jj3A5N8.png,,2013-05-13T01:30:49Z
2024-02-27,https://github.com/donnemartin/system-design-primer,https://raw.githubusercontent.com/Eladlev/AutoPrompt/main/README.md,"Auto Prompt is a framework designed to improve the crafting of prompts for use with large language models (LLMs), tackling challenges like prompt sensitivity and ambiguity. It automates the generation of detailed prompts, refining them through an iterative process that builds a dataset of challenging edge cases. The intent is to reduce manual effort and efficiently address common issues, enhancing prompt reliability and performance with minimal data input.

Developed with modularity, it integrates easily with various tools and adapts to different tasks, including moderation and content generation. The framework's method involves generating synthetic data samples, annotating them, and evaluating prompt performance to suggest improvements. This process aims at producing robust, high-quality prompts swiftly and affordably.

Auto Prompt supports setting a budget for optimization, monitors usage to manage costs, and encourages continuous refinement to achieve the best results. Contributions are welcomed, with a community on Discord for collaboration. The project is provided as-is, with a focus on enhancing LLM prompt efficiency without guaranteeing absolute correctness or bias elimination. It's licensed under Apache 2.0, with a paper providing further details on its methodology.",,AI-Optimization-Toolkit,https://raw.githubusercontent.com/Eladlev/AutoPrompt/main/./docs/AutoPrompt_Diagram.png; https://raw.githubusercontent.com/Eladlev/AutoPrompt/main/./docs/autoprompt_recording.gif,,340,https://raw.githubusercontent.com/Eladlev/AutoPrompt/main/./docs/AutoPrompt_Diagram.png; https://raw.githubusercontent.com/Eladlev/AutoPrompt/main/./docs/autoprompt_recording.gif,,2017-02-26T16:15:28Z
2024-02-27,https://github.com/Eladlev/AutoPrompt,https://raw.githubusercontent.com/dnakov/r2d2/main/README.md,"The r2d2 project introduces a plugin for radare2 that integrates GPT-4, enabling it to execute and interpret radare2 (r2) commands autonomously. This collaboration aims to leverage the advanced capabilities of GPT-4 in understanding and interacting with binary analysis tasks through radare2, a well-known reverse engineering framework. Users interested in utilizing this plugin need to first install radare2 from its source repository. Following this, the installation of the plugin is straightforward, requiring only two commands to add both the necessary Python language support and the r2d2 plugin itself. Usage involves launching radare2 with the r2d2 plugin enabled, passing the binary file to be analyzed as an argument. This innovation represents a significant step forward in making binary analysis more interactive and automated by combining the strengths of radare2 and GPT-4.",,AI-Assistant-System,,,179,,,2023-12-02T18:45:14Z
2024-02-27,https://github.com/dnakov/r2d2,https://raw.githubusercontent.com/Textualize/rich/master/README.md,"Rich is a versatile Python library designed to enhance terminal output with rich text and beautiful formatting, including colors, styles, tables, progress bars, markdown, syntax-highlighted code, tracebacks, and more. Its API simplifies adding visually appealing elements to terminal applications. Rich is compatible with Linux, OSX, Windows, and supports True color and emojis on modern terminals. It requires Python 3.7 or later and integrates effortlessly with Jupyter notebooks. Installation is straightforward using `pip`. Rich enhances the Python REPL and standard output with features like pretty printing, advanced logging, and rich content rendering such as tables, progress bars, and syntax highlighting. Additionally, it offers functionalities like interactive trees, columns layouts, markdown rendering, and customizable tracebacks for better error inspection. Rich aims to make CLI applications more interactive and user-friendly, and also powers the Rich CLI tool for performing various terminal tasks with rich formatting. It works closely with its sister project, Textual, to build sophisticated terminal UIs.",,Python-Library,https://github.com/textualize/rich/raw/master/imgs/features.png; https://github.com/textualize/rich/raw/master/imgs/print.png; https://github.com/textualize/rich/raw/master/imgs/repl.png; https://github.com/textualize/rich/raw/master/imgs/hello_world.png; https://github.com/textualize/rich/raw/master/imgs/where_there_is_a_will.png; https://github.com/textualize/rich/raw/master/imgs/inspect.png; https://github.com/textualize/rich/raw/master/imgs/log.png; https://github.com/textualize/rich/raw/master/imgs/logging.png; https://github.com/textualize/rich/raw/master/imgs/table_movie.gif; https://github.com/textualize/rich/raw/master/imgs/table.png; https://github.com/textualize/rich/raw/master/imgs/table2.png; https://github.com/textualize/rich/raw/master/imgs/progress.gif; https://github.com/textualize/rich/raw/master/imgs/downloader.gif; https://github.com/textualize/rich/raw/master/imgs/status.gif; https://github.com/textualize/rich/raw/master/imgs/spinners.gif; https://github.com/textualize/rich/raw/master/imgs/tree.png; https://github.com/textualize/rich/raw/master/imgs/columns.png; https://github.com/textualize/rich/raw/master/imgs/markdown.png; https://github.com/textualize/rich/raw/master/imgs/syntax.png; https://github.com/textualize/rich/raw/master/imgs/traceback.png; https://raw.githubusercontent.com/Textualize/rich-cli/main/imgs/rich-cli-splash.jpg; https://raw.githubusercontent.com/Textualize/textual/main/imgs/textual.png,,46528,https://github.com/textualize/rich/raw/master/imgs/features.png; https://github.com/textualize/rich/raw/master/imgs/print.png; https://github.com/textualize/rich/raw/master/imgs/repl.png; https://github.com/textualize/rich/raw/master/imgs/hello_world.png; https://github.com/textualize/rich/raw/master/imgs/where_there_is_a_will.png; https://github.com/textualize/rich/raw/master/imgs/inspect.png; https://github.com/textualize/rich/raw/master/imgs/log.png; https://github.com/textualize/rich/raw/master/imgs/logging.png; https://github.com/textualize/rich/raw/master/imgs/table_movie.gif; https://github.com/textualize/rich/raw/master/imgs/table.png; https://github.com/textualize/rich/raw/master/imgs/table2.png; https://github.com/textualize/rich/raw/master/imgs/progress.gif; https://github.com/textualize/rich/raw/master/imgs/downloader.gif; https://github.com/textualize/rich/raw/master/imgs/status.gif; https://github.com/textualize/rich/raw/master/imgs/spinners.gif; https://github.com/textualize/rich/raw/master/imgs/tree.png; https://github.com/textualize/rich/raw/master/imgs/columns.png; https://github.com/textualize/rich/raw/master/imgs/markdown.png; https://github.com/textualize/rich/raw/master/imgs/syntax.png; https://github.com/textualize/rich/raw/master/imgs/traceback.png; https://raw.githubusercontent.com/Textualize/rich-cli/main/imgs/rich-cli-splash.jpg; https://raw.githubusercontent.com/Textualize/textual/main/imgs/textual.png,,2024-02-09T00:21:06Z
2024-02-27,https://github.com/Textualize/rich,https://raw.githubusercontent.com/bregman-arie/devops-exercises/master/README.md,"I'm sorry, but I cannot provide the requested information without the content of the text or images you are referring to. If you provide the actual content or details, I'd be happy to help summarize it.",,"I'm sorry, but I cannot fulfill this request.",,,62173,,,2019-11-10T15:28:09Z
2024-02-27,https://github.com/bregman-arie/devops-exercises,https://raw.githubusercontent.com/frappe/frappe/master/README.md,"Frappe is a full-stack web application framework, integrating a server side powered by Python and MariaDB, and a client side library that work closely together. It is designed for building and running applications like ERPNext, a notable implementation. It is pronounced ""fra-pay"" and comes with a comprehensive set of ""batteries included"" to help developers. For installation, Frappe recommends using the Frappe Bench method. The community is encouraged to contribute through pull requests, adhering to specific guidelines, and translating project documents. Further information, documentation, and a detailed guide on how to use Frappe are available on their [website](https://frappe.io). The project is open-source, licensed under the MIT License.",,Web-Framework,,https://www.youtube.com/watch?v=LOjk3m0wTwg,6283,,,2019-10-03T17:31:21Z
2024-02-27,https://github.com/frappe/frappe,https://raw.githubusercontent.com/blakeblackshear/frigate/master/README.md,"Frigate is a fully complete, local Network Video Recorder (NVR) system designed for integration with Home Assistant, providing AI-driven realtime object detection for IP cameras. It utilizes OpenCV and TensorFlow for local object detection, significantly enhancing efficiency and responsiveness. Frigate supports the optional use of a Google Coral Accelerator to further boost performance, capable of handling 100+ FPS with minimal overhead. Key features include tight Home Assistant integration, minimal resource usage, strategic object detection to maximize performance, multiprocessing for real-time processing, low overhead motion detection, separate processes for object detection using TensorFlow, MQTT communication for broad system compatibility, video recording with smart retention based on detected objects, 24/7 recording, and re-streaming capabilities to alleviate camera connection loads. Additionally, it offers WebRTC & MSE for low-latency live viewing. Frigate's documentation is accessible online, and the project accepts donations via Github Sponsors. The system also features a user interface for easy interaction and monitoring.",,Object-Detection,https://raw.githubusercontent.com/blakeblackshear/frigate/master/docs/static/img/events-ui.png,,13785,https://raw.githubusercontent.com/blakeblackshear/frigate/master/docs/static/img/events-ui.png,,2011-06-08T08:14:16Z
